{
  "schemaVersion": 1,
  "atlasVersion": "0.5.0",
  "template": "standard",
  "setupState": "configured",
  "artifactRoot": ".ai",
  "agentSurfaces": [
    "claude",
    "agents",
    "cursor"
  ],
  "paths": {
    "language": "LANGUAGE.md",
    "memory": "memory",
    "plans": "plans",
    "research": "research",
    "decisions": "decisions",
    "adrs": "decisions/adrs",
    "results": "results",
    "skills": "skills"
  },
  "pathAliases": {
    "docs/plans": "plans",
    "docs/adrs": "decisions/adrs",
    "docs/specs": "research"
  }
}
